id_str,full_text,retweet_count,favorite_count,retweeted,coordinates,created_at
1111273077437018112,"MATA AS MINHAS CURIOSIDADES 

1- 1
2- 0 🤷🏻‍♀️
3- tô?
4- depende doq vc considera tem um corredor muito apertado, no meio de um gramado na rua, uma árvore 
5- 2?
6- 0
7- n*
8- eu jogo lol
9- J
10- A
11- Não 
12- o tempo todo 
13- Já/difícil 
 
MAMA EU",0,4,False,,Thu Mar 28 14:25:22 +0000 2019
1081007853828300800,"okay, eu vou dormir na rua porque não passa mais ônibus",0,1,False,,Fri Jan 04 02:02:11 +0000 2019
1136421512154636289,@HOPELIGION A escola fica em uma rua rebaixada e em frente (na rua principal em cima) tem um monte de árvores com uns canteiros. A viatura parou perto de uma árvore dessa e saiu rapidinho. Não demos muita confiança e continuamos lá de boa...,0,0,False,,Wed Jun 05 23:56:16 +0000 2019
1113202729986424833,Pq não passa ônibus na rua vergueiro,0,0,False,,Tue Apr 02 22:13:07 +0000 2019
1082848612210618369,"Meu pai é aquele tipo de cara que se passa uma mulher na rua e mesmo que ela esteja acompanhada, ele solta uma piadinha desnecessária
Meu padrasto é aquele homem que dentro do ônibus ou em qlq lugar faz a bailarina pra não deixar nenhuma a mulher desconfortável",3,8,False,,Wed Jan 09 03:56:42 +0000 2019
1122958469299150848,@ZHYX91 Se não tem mais de uma árvore na sua rua não pode andar com a gente,0,0,False,,Mon Apr 29 20:18:57 +0000 2019
1093617819483365379,Na minha rua pra não falar que não tem nenhuma árvore tem umas palmeiras de Jardim na casa de esquina que não faz sombra nem pra uma pessoa e nem mexe pra ventar,0,0,False,,Thu Feb 07 21:09:41 +0000 2019
1083338549230006272,"Tem uns baratos que não dá pra perceber. Que tem mó valor e você não ve. Uma pá de arvore na praça, as criança na rua. O vento fresco na cara, as estrela, a lua...",1,2,False,,Thu Jan 10 12:23:32 +0000 2019
1113254604785967111,"Tem uns baratos que não dá pra perceber, que tem mó valor e você não vê, uma pá de árvore na praça
as criança na rua o vento fresco na cara as estrela
a lua...",0,1,False,,Wed Apr 03 01:39:15 +0000 2019
1093077635880701952,#bdsp Bom dia vou deixar registrado minha reclamação estou no ponto de ônibus na rua dos filhos da terra próximo ao número 630 no bairro dos filhos da terra esperando ônibus Largo da Concórdia 2105 até agora não passou um ônibus e o Tucuruvi 1772 passa lotado e não para #sptrans,0,0,False,,Wed Feb 06 09:23:11 +0000 2019
1126514299491508225,"@decooazevedo @ByancaFonseca Agora que eu reparei! Mas foi pq eu me liguei naquele árvore lá no final! Mas parece muito muito mesmo, uma rua lá de Vicente! Só que lá não tem esse arvorezinha que tem na 1! Peguei a visão legal agora",1,1,False,,Thu May 09 15:48:33 +0000 2019
1096035162247303168,@anonline Acho que deveria ser em todas as ruas onde passa o ônibus não só na rua São Paulo.,0,0,False,,Thu Feb 14 13:15:20 +0000 2019
1087725077330837505,"Se tudo passa, porque o ônibus não passa na minha rua? :(",0,0,False,,Tue Jan 22 14:54:02 +0000 2019
1116152502964113409,"Tem uns baratos que não dá pra perceber que tem mó valor e você não vê. 
Uma pá de árvore na praça, as crianças na rua, o vento fresco na cara, as estrela, a lua.",0,0,False,,Thu Apr 11 01:34:28 +0000 2019
1123001674480738304,"Cada dia q passa fumantes nutrindo meu nojo por eles. Um cara acabou de tacar um cigarro na MINHA BARRIGA pq ele ia entrar no ônibus e ele tinha q descartar o cigarro (na rua, no caso) e ainda tava acesso e pela metade. Ainda tive que agradecer por não ter queimado minha roupa",0,2,False,,Mon Apr 29 23:10:38 +0000 2019
1100205071722299392,"@Leandrosouzaaf Mano, na minha rua caiu uma árvore enorme, poste partiu no meio, um telhado gigante em cima da fiação, o bombeiro foi tirar levou uma descarga, saiu todo torto .. Cenas pós apocalipse, não tem noção!!!!",0,0,False,,Tue Feb 26 01:25:04 +0000 2019
1113761887265742854,"minha história pegando o 302

1° dia: segui o google maps e parei numa rua que só passa o 302 e simplesmente NAO TEM ponto na rua. esperei por meia hora numa rua deserta sem saber se o ônibus ia passar ou não",0,0,False,,Thu Apr 04 11:15:01 +0000 2019
1114289377084092416,PRA QUE CARALHO PONTO DE ÔNIBUS NA RUA VERGUEIRO SE NAO PASSA A PORRA DE UM ÔNIBUS,0,0,False,,Fri Apr 05 22:11:04 +0000 2019
1105499123044749312,"Daquele meu amigo que não deixa compartilhar:

“Imaginem se o Queiroz II, preso hoje, fosse primo de um amigo de um cara que corta cabelo numa barbearia que fica na rua onde passa um ônibus cujo motorista foi casado... https://t.co/17KyMplhXe",0,0,False,,Tue Mar 12 16:01:44 +0000 2019
1100510283385237504,"Eu peguei o onibus q passa na minha rua, com ele eu nao tenho q subir morro, mas foi dificil descobrir aonde eu descia(ainda nao criei um ponto de referencia)por causa da chuva.
Mas so de eu nao ter q subir o morro o onibus ja compensa.
Odeio morro.",0,0,False,,Tue Feb 26 21:37:52 +0000 2019
1129411219331387394,"Acordo 8 da manhã 
Piso na bosta de cachorro
Penso "" ih, isso da sorte""
Vou para rua
Um ônibus passa e joga agua em mim
Continuo andando
Afundo em uma poça d'agua e meu tênis e meia se vão 
Chego no trabalho capenga

Dia de sorte não é mesmo",0,1,False,,Fri May 17 15:39:52 +0000 2019
1120982888021884928,"@g1_sptv Glória bom dia. Temos  um problema imenso aqui na casa Verde. Na rua Aburá passa o ônibus Santana 971-t, uma rua estreita que quando um ônibus está voltando, o outro tem que voltar metade do caminho por que os dois não passam, muito complicado,",0,0,False,,Wed Apr 24 09:28:42 +0000 2019
1135109791058186240,todo dia o cu não passa uma agulha de ficar no ponto de ônibus sozinha na rua escura,1,1,False,,Sun Jun 02 09:03:58 +0000 2019
1137528234843758592,"Ser mulher é: ser assediada frequentemente.
Você não pode ficar no ponto esperando ônibus que passa uns cara buzinando e olhando pra ti. Isso dá muito medo.
Você tem que pensar duas vezes em usar uma roupa, porque pode ser tocada por um otário na rua.
Em pleno século XXI isso.",3,5,False,,Sun Jun 09 01:14:00 +0000 2019
1134678645786759174,"@wonderfulcevans @camilaasals Oq eu acho mais engraçado não é a árvore estar bem cuidada, é não ter macumba nela.
Só tem uma árvore na minha rua, e usam ela pra fazer as oferendas (?)",0,2,False,,Sat Jun 01 04:30:45 +0000 2019
1108377454396301313,mano dia de hoje mru ônibus nao passa na avenida por conta da feira aqui do bairro ele corta pela rua de tras ne blz só que eu esqueci disso e fui p ponto d avenida e qnd eu vi ele entrou na rua de trás,0,0,False,,Wed Mar 20 14:39:12 +0000 2019
1109225557034745857,"vocês tem noção que não passa um ônibus na rua da minha avó??? 
e eu tenho um medo danado de andar na rua sozinha a noite????? 

ENTAO GENTE FODEU",0,1,False,,Fri Mar 22 22:49:15 +0000 2019
1128321721877127168,"@clarisseholanda @skosjaihs Sei la, frio é muito pior na minha opinião. Calor os dog deita em baixo de uma árvore que já melhora. O frio não tem o que fazer cara, frio você bota casaco e ainda sente frio imagina na rua como não deve ser. Não tem opção, não tem o que fazer pra se esquentar, é muito pior",0,0,False,,Tue May 14 15:30:36 +0000 2019
1131528723872788481,"meu ponto de referência de que está na hora de ir pro ponto de ônibus é o carro do gás que passa todo dia na minha rua, hoje o carro não passou, tive que dar uma de velozes e furiosos versão a pé pra pegar o ônibus",0,1,False,,Thu May 23 11:54:05 +0000 2019
1105669661268557824,"Ele é tio do vizinho do primo do colega de trabalho do motorista de onibus que passa quase na rua da casa do bolsonaro, não pode ser coincidência, eles tem ligação um com o outro sim",0,0,False,,Wed Mar 13 03:19:24 +0000 2019
1080833334064889856,"Tem uns bagulho que não da pra perceber , que tem mó valor e vc não vê, uma par de arvore na praça, as crianças na rua , o vento fresco na cara , as estrelas a lua! ♪",0,0,False,,Thu Jan 03 14:28:42 +0000 2019
1138904019156574211,"Tem uns baratos que não dá pra perceber
Que tem mó valor e você não vê
Uma pá de árvore na praça, as crianças na rua 
O vento fresco na cara, as estrela, a lua",0,2,False,,Wed Jun 12 20:20:52 +0000 2019
1106196575045517312,"Hoje não é meu dia, galero. Fiquei esperando 10 minutos o ônibus pra descobrir que ele só passa cartão. Fui atravessar a rua e um pombo cagou na minha blusa, ok",0,4,False,,Thu Mar 14 14:13:10 +0000 2019
1083390614828396547,"@dibiel O sistema BRT funciona, entre outros motivos, porque o passageiro faz tudo com antecedência. Vc não vê sinalização nos pontos de ônibus nem na rua. Site desorganizado, horários que não batem, aplicativos ruins... tanta coisa passa pela tecnologia...",0,0,False,,Thu Jan 10 15:50:25 +0000 2019
1114133742765867009,"de andar na rua sozinha, mesmo à tarde ou de manhã. medo de pegar ônibus e ao mesmo tempo medo de pegar uber e não da pra andar de uber o tempo td pq não tenho dinheiro pra isso e o medo é maior também. qnt mais tempo passa mais eu me dou conta dos casos de assédio e mulheres",0,0,False,,Fri Apr 05 11:52:38 +0000 2019
1125539226433486849,"Têm uns baratos que não dá pra perceber
que tem mó valor e você não vê
uma pá de árvore na praça
as criança na rua
o vento fresco na cara
as estrela
a lua",0,0,False,,Mon May 06 23:13:57 +0000 2019
1080973763808768000,"Incrível como a minha prima que tá aqui em casa passa na rua cmg e fala com geral, mesmo não morando aqui, até dentro do ônibus quando não tá do meu lado ela consegue puxar assunto, diferente de mim 😂😂😂😂😂",0,0,False,,Thu Jan 03 23:46:43 +0000 2019
1091661303264002048,"Tem uns baratos que não dá pra perceber
Que tem mó valor e você não vê
Uma pá de árvore na praça
As criança na rua
O vento fresco na cara
As estrela
A lua",0,0,False,,Sat Feb 02 11:35:11 +0000 2019
1117094306358157312,se vc não tem que se preocupar com horário de ônibus pq na sua rua passa vários toda hora VC É PRIVILEGIADA SIM,0,0,False,,Sat Apr 13 15:56:51 +0000 2019
1123030698821070848,que angustia eu fico quando tudo começa fechar na rua da faculdade e meu ônibus não passa,0,0,False,,Tue Apr 30 01:05:58 +0000 2019
1113527019848065024,"tem uns barato que não da perceber, que tem mó valor e você não vê...

uma pa de árvore na praça, as criança na rua, o vento fresco na cara as estrelas a lua...",0,1,False,,Wed Apr 03 19:41:44 +0000 2019
1088124599085211651,Ele deve ter se confundido na previsão ... ele não disse que você morreria em 130 dias e sim que o número 130 (número do ônibus) Campo Grande-Centro viria rápido contra ele. E no parabrisa estaria escrito ... passa pela Rua Agnaldo Santos também em Campo Grande ... foi isso https://t.co/0U7BuWbjgG,0,0,False,,Wed Jan 23 17:21:35 +0000 2019
1085641867218337802,"Da série ""nenhuma boa ação passará sem punição"":
Uma moça na rua me pergunta como pegar o ônibus XX. Solícito, digo que não sei, mas que vou olhar no aplicativo. O ônibus que ela queria passa, e ela xinga ""Aí, moço, você ficou olhando no celular e me fez perder o ônibus"".",0,1,False,,Wed Jan 16 20:56:06 +0000 2019
1081598436015828992,"políticos de nova iguacu, favor investir mais no transporte e ajeitar o asfalto das ruas pelo amor de Deus porque não dá pra eu escutar música no ônibus, o ônibus faz um barulho da porra e quando passa na rua esburacada fica pior ainda",0,0,False,,Sat Jan 05 17:08:56 +0000 2019
1117817745146556417,engraçado que: falei pro meu pai que não ia descer pq o ônibus passava mais tarde ai blz quando tava descendo a rua passaram dois um atrás do outro eu nem ia correr né e nem adiantei o passo pensando que não vinha outro quando eu chego na delegacia me passa outro ônibus eu ah não,0,0,False,,Mon Apr 15 15:51:33 +0000 2019
1095756292558344193,Não passa ninguém na rua é pegar a bola bater uma Altinha passa até ônibus,0,0,False,,Wed Feb 13 18:47:12 +0000 2019
1100935182889246720,"Quando eu NÃO QUERO ir: Gente me dá carona, passa um ônibus atrás do outro, Uber está 50% off, e o dia está lindo.

Quando EU QUERO ir: Não passa um carro na rua, ônibus não existe, Uber está o dobro do preço porque a chuva alagou a cidade.",0,2,False,,Thu Feb 28 01:46:16 +0000 2019
1100391908776595456,"@raphaelfaraco Aqui na minha rua na Trindade tem uma árvore maior, fizeram uma denuncia no pro cidadão, foram lá fiscalizar e disseram que não havia nada irregular. Ontem caíram mais galhos quase comprometendo a fiação. Será que vão esperar cair a arvore inteira ou alguém ser atingido?",1,1,False,,Tue Feb 26 13:47:30 +0000 2019
1116757515390390273,"@amagnun Minha ex cunhada tem fobia d lagarta, essas pequena d árvore, não pode ver uma q passa mal, é algo q a gente sabe q não vai fazer mal, mas ela tem pavor, chora, grita, uma vez derrubou um homem na rua quando viu uma e saiu gritando.",0,0,False,,Fri Apr 12 17:38:34 +0000 2019
1112550521775276032,"tem uns barato que não dá pra perceber, que tem mó valor e vc não vê, uma pá de árvore na praça, as crianças na rua, o vento fresco na cara, as estrela, a lua.",0,0,False,,Mon Apr 01 03:01:29 +0000 2019
1117571835237928960,"Eu acho engraçado, a pessoa te tem em todas as redes sociais, mas passa na rua, no ponto de ônibus e finge que não te conhece 😂😂",0,2,False,,Sun Apr 14 23:34:23 +0000 2019
1108006883636510720,Tem uns baratos que não dá pra perceber que tem mo valor e você não vê. Uma pá de árvore na praça as criança na rua o vento fresco na cara as estrelas a lua ... 💭,0,0,False,,Tue Mar 19 14:06:41 +0000 2019
1087407711980060678,"Nego tem que parar de me pedir informação na rua, eu só sei onde eu quero chegar, mas nome de rua, onde tal ônibus passa eu não sei não, bicho kkkkk",0,0,False,,Mon Jan 21 17:52:56 +0000 2019
1111436750172221440,"É uma rua principal, passa ônibus nos dois sentidos, o carro parado começou a atrapalhar o trânsito, com as buzinas ele teve que sair do meio da rua né. Não contei nada p ngm na loja, só esperei um pouquinho, olhei na porta não vi mais o carro e segui meu caminho.",0,0,False,,Fri Mar 29 01:15:45 +0000 2019
1134165720013660163,"Tem uns baratos que não dá pra perceber
Que tem mó valor e você não vê
Uma pá de árvore na praça, as crianças na rua
O vento fresco na cara, as estrela, a lua",0,0,False,,Thu May 30 18:32:34 +0000 2019
1126609812026949633,não sei q ônibus pegar pra parar na rua do portão A o q eu geralmente pego passa no B,0,0,False,,Thu May 09 22:08:05 +0000 2019
1138751707125551106,"EU TO MUITO PUTAAAAA

AH NÃO gente o motorista do ônibus QUE EU PEGO TODO DIA NÃO PAROU PRA MIM E O ÔNIBUS PASSA NA RUA DA MINHA CASA E O PONTO É NA ESQUINA E EU SÓ ESTAVA TRANCANDO O PORTãO

CUSTAVA CARALHO CUSTAVAAAA? NÃO CUSTAVA FDP",0,1,False,,Wed Jun 12 10:15:38 +0000 2019
1085628449933410305,"Eu não aguento mais desmaiar na rua por causa desse calor!!!
Não posso nem reclamar que tão tentando matar a gente pq humano é tudo cuzão, eu ia cair durinha no asfalto quente pq não tem uma porra duma árvore na rua",0,5,False,,Wed Jan 16 20:02:47 +0000 2019
1108891682618204160,"Tipo de treta que acontece na minha rua, meu vizinho tem um ônibus e o caminhão do lixo não passa kkkkkkkkkkkkkkkk",0,2,False,,Fri Mar 22 00:42:34 +0000 2019
1115254746946899968,"tem uns baratos q não dá p perceber q tem mó valor e vc não vê, uma pá de árvore na praça, as crianças na rua, o vento fresco na cara, as estrelas, a lua",0,4,False,,Mon Apr 08 14:07:06 +0000 2019
1101320842972184578,"Boa noite,meu gato sumiu faz 2 noites, se alguém pegou que devolva. Moro na rua Idylio Victoria, onde passa o ônibus! Sei que pegaram porque ele e filhote! Não quero ter que ver na mão de alguém e ter que tirar! Minha mãe quer o gato.",0,0,False,,Fri Mar 01 03:18:45 +0000 2019
1091000714065821696,Aqui na rua não tem uma sombra de árvore mané,0,0,False,,Thu Jan 31 15:50:14 +0000 2019
1139221652263374849,"desde 12h na rua tentando chegar no trabalho, não passa ônibus, tudo alagado, uber não consegue encontrar um motorista, 99 dando cinquenta reais RECIFE NÃO AGUENTA CHUVA",0,1,False,,Thu Jun 13 17:23:02 +0000 2019
1083536894477197317,"o alto da paz é o único ônibus q passa na minha rua, sorte q ainda não resolveram queimar os menos favorecidos",0,1,False,,Fri Jan 11 01:31:41 +0000 2019
1089993537402429440,"No momento deitado no chão da sala e quase chorando porque só queria tomar um banho, esquentar uma marmita e jogar, MAS NÃO TEM LUZ NESSA PORRRA PORQUE TÃO PODANDO A DESGRAÇA DE UMA ÁRVORE GIGANTE NA RUA",0,0,False,,Mon Jan 28 21:08:05 +0000 2019
1128134540902502400,"Tem uns baratos que não dá pra perceber que tem mó valor e você não vê,. Uma pá de árvore na praça, as crianças na rua o vento fresco na cara, as estrelas a lua",0,0,False,,Tue May 14 03:06:48 +0000 2019
1101470906524815360,"""(...)Tem uns baratos que não dá pra perceber.
Que tem mó valor e você não vê.
Uma pá de árvore na praça, as crianças na rua.
O vento fresco na cara, as estrela, a lua.(...)""",0,1,False,,Fri Mar 01 13:15:03 +0000 2019
1112099045466607617,"Tem uns baratos que não dá pra perceber
Que tem mó valor e você não vê
Uma pá de árvore na praça
As criança na rua
O vento fresco na cara
As estrela
A lua  🎧🎧🌙",0,1,False,,Sat Mar 30 21:07:28 +0000 2019
1093318358953529344,"@Central_1746 @OperacoesRio 1746 vcs poderiam ter evitado podando as árvores essa prefeitura é uma vergonha, eu moro na rua onde tem um posto da Comlurb e foi um desastre de tanta árvore que caiu e ainda arrebentou fio , eu ja havia pedido poda e não me atenderam.",0,0,False,,Thu Feb 07 01:19:44 +0000 2019
1080852915433148417,"Eu cresci subindo em árvore, andando de skate, jogando bola na rua, roubando os carrinhos do meu irmão, usando calça larga e tênis grandão, ouvindo rap e rock e andando com maloqueiro (tudo que uma menina não deveria fazer)
Hoje sou uma princesinha 😊😂
O povo tem q relaxar",0,1,False,,Thu Jan 03 15:46:30 +0000 2019
1085624914164531200,Se tem algo que eu não tenho paciência é pra pessoas velhas no metrô/ônibus. A pessoa passa o dia na rua e aí quando a porta se abre é a primeira a querer sentar mas pra ficar na rua é tranquilo..,0,0,False,,Wed Jan 16 19:48:44 +0000 2019
1090262032895553538,"O FILHA DUMA PUTA sabe que passa ônibus na  rua o dia inteiro, tem a rua toda p ele estacionar, MAS NÃO, TEM QUE ESTACIONAR DO OUTRO LADO DA RUA, DO LADO DO SEU CARRO",0,0,False,,Tue Jan 29 14:54:59 +0000 2019
1104427977385934848,"@transwolff Boa tarde estou aqui na rua frederico René , próximo do atacadista vencedor e ATE AGORA MMAIS DE 40 MINUTOS NAO PASSA NENHUM ÔNIBUS  VILA ALPINO 677V  E  O ÔNIBUS UNISA 6030  PONTO DE ÔNIBUS LOTADO,  QUE LIXO DE SERVIÇO E O TELEFONE 0800 DA EMPRESA QUE SO CHAMA 😡",0,0,False,,Sat Mar 09 17:05:23 +0000 2019
1128260780753866752,"No Rio de Janeiro é assim, se um ônibus da problema na rua, não tem triângulo de sinalização não, é madeira, pedra, galho de árvore. Qualquer coisa pra sinalizar, menos o correto. Isso pq as empresas de ônibus cobram uma passagem cara e alegam estarem falidas... https://t.co/mWEu4y3xN6",0,1,False,,Tue May 14 11:28:26 +0000 2019
1120330245582802945,"Curitiba tão moderna, né? Pois eu queria ir de ônibus a uma consulta, ok. Só que o ônibus que passa na rua da nutricionista não aceita dinheiro, só cartão. E eu não tenho cartão de ônibus. É mole?",0,6,False,,Mon Apr 22 14:15:19 +0000 2019
1126095171152642050,"assistindo o maior do Brasil , uns pela vitoria outros pela derrota, ele movimenta, você passa na rua e parece copa do mundo todos os televisores ligados, todos torcendo, pessoas correndo pra pegar o ônibus, pessoas ligadas pelo telefone, não tem explicação. Um torcedor não torce",1,3,False,,Wed May 08 12:03:05 +0000 2019
1137436510087720960,"Ok hitsuzen ataca de novo, eu na rua da minha casa esperando o ônibus e a própria desgraça passa de carro por mim TIPO A PESSOA MORA NA OUTRA ZONA DA CIDADE E COINCIDENTEMENTE APARECE. Eu não aguento mais????",0,0,False,,Sat Jun 08 19:09:31 +0000 2019
1085882870000840704,"Na frente do nº 792 da rua Cerro Corá há um buraco no meio fio e há um mês aumenta sempre. Quebra molas de carros e os ônibus passando rente ditribuem água suja por quem passa na calçada. DSV já passou, fotografou e não fez nada. Qual o procedimento? https://t.co/RUL48DaqJJ",0,0,False,,Thu Jan 17 12:53:45 +0000 2019
1114251708442587136,"Tinha uma puta árvore na minha rua (se não me engano era uma centenária) que deixava toda a rua com um ambiente mto agradável e tals, fui sair hoje e vi que algum filho da puta cortou a árvore, agora a rua só tem prédios
 Tô sad",0,2,False,,Fri Apr 05 19:41:23 +0000 2019
1098963781143670790,"odeio a rua que eu moro por ser longe de tudo e o ônibus simplesmente não passa na av de São Pedro, n da pra ir a pé pq se torna longe e perigoso, mas tb gosto pq aqui é calmo e cheio de verde",0,1,False,,Fri Feb 22 15:12:37 +0000 2019
1090616343928422400,"Acho que eram só espíritos tentando entrar mesmo, sai na rua e não tem uma folha de árvore mexendo 🙄😪",0,0,False,,Wed Jan 30 14:22:53 +0000 2019
1122951540208279554,"Trindade Rua Avenida São Paulo principal rua de ônibus altura do número 1607Cadê a Cedae passa olha e não faz nada olha o carro na foto,mais d um mês uma tubulação estourada moradores tapando com cascalhos buraco estar enorme e água disperdiçando o dia todo molhando pessoal https://t.co/Iptt3BXcFu",2,5,False,,Mon Apr 29 19:51:25 +0000 2019
1085547362435719168,#sp1 trali aqui na zona leste bairro de Itaquera travessa da rua professor Hasegawa com a hisaji Morita temos uma rua de terra com muitos buracos não tem condições ainda mais quando chove mora muitas pessoas nesta região passa ônibus é um perigo a noite,0,1,False,,Wed Jan 16 14:40:34 +0000 2019
1092567513081282560,"@himissingpieces Uber  cai da o preço mínimo tipo 7 golpes todo dia é  puxado 
É o ônibus deixa na transversal  ai eu tenho que andar uma rua inteira e virar na esquina que é  mais pra dentro 
Ônibus não passa lá  
Só  na principal",0,1,False,,Mon Feb 04 23:36:08 +0000 2019
1137000902269767680,"gnt eu prefiro o frio, tu não morre passando mal por frio, tipo tu põe uma roupa quente e fica de boas, mas no calor tu é pobre, sem ar condicionado, tu não consegue sair na rua de tão quente, passa mal afú! Pega ônibus lotado,com todo mundo em uma inhaca. Nd faz passar o calor",0,0,False,,Fri Jun 07 14:18:34 +0000 2019
1081013024901734400,"@eueinlibriana na verdade o ônibus que o lucas pega, o 07 ele passa na rua de trás, ou seja, tu não anda nem o que tu anda pra chegar no ap o q tu anda pra esse teu",0,0,False,,Fri Jan 04 02:22:44 +0000 2019
1108759443364347904,"@Ju_zak @rapskrrrr @D_Ferrer29 @cauagomex Gente, o único erro dela foi ter pego muita muda. Tá na rua, isso cresce de novo!
Na frente de casa a gente tem uma árvore que todo mundo que passa arranca um fruto ou um galho p plantar e não faz falta nenhuma.
Nunca fizemos nada disso com ninguém",14,538,False,,Thu Mar 21 15:57:05 +0000 2019
1111959025707552770,"Tem uns baratos que não dá pra perceber
que tem mó valor e você não vê
uma pá de árvore na praça
as criança na rua
o vento fresco na cara
as estrela
a lua 🎶🎶",2,13,False,,Sat Mar 30 11:51:05 +0000 2019
1100206870395080704,"Teve um acidente na rua onde meu ônibus passa, ai o motorista pediu pra eu descer e ajudar ele a manobrar da rua, geeeeenteeee kkkkk achei o máximo 😂😂 nao sei pq mas me senti A motorista viu",0,0,False,,Tue Feb 26 01:32:13 +0000 2019
1105064095563300865,"Daí esse ônibus não entra no terminal ele passa na rua do lado, eu aperto para descer e ele desce e a umas 8 quadras de distância",0,0,False,,Mon Mar 11 11:13:06 +0000 2019
1123200821628477440,"@dzsyren @alexcastro_de Esses caras quererem tirar o título de Patrono da Educação do Paulo Freire é fácil. Quero ver pisar numa sala de aula na periferia, no interior, no sertão e dar aula. Isso quando tem sala de aula, com teto, com piso, quando não precisa dar aula na rua, de baixo de uma árvore",0,3,False,,Tue Apr 30 12:21:58 +0000 2019
1118708340476063745,"So passa um ônibus na minha rua, pego ele pra ir pro estágio todos os dias, mas hoje não teve estágio

Foi exatamente ele que tava no acidente de hoje, no horário que eu sempre pego, mas hoje saí mais tarde

O livramento mores",0,7,False,,Thu Apr 18 02:50:27 +0000 2019
1124378904515555329,"Eu não sei o nome das ruas então se  a pessoa me pergunta a esse ônibus passa na rua tal

Eu não sei

Eu não seeeeeei 

Só sei que chega na minha casa",0,1,False,,Fri May 03 18:23:15 +0000 2019
1124266474053558272,Q inferno fiquei 30 min no ponto e o ônibus não passou qq deu nesse motorista hj ?! Esqueceu de passa na minha rua,0,2,False,,Fri May 03 10:56:29 +0000 2019
1105298521564086273,"@AVENAoficial Nunca vi a OAB defender um trabalhador que passa fome, que pega ônibus lotado como se fosse gado ou pra famílias que catam papelão na rua ou reviram lixo pra ter o que comer.. A OAB é a maior pra quem pode pagar. OAB não é pra todos",0,4,False,,Tue Mar 12 02:44:37 +0000 2019
1109288793226522624,"Eu vendo a galera reclamar do transporte público do Rio.
Não sei se to aliviada por aqui ser tudo perto e eu ir andando e ainda ser agraciada pelo busuff, que passa na minha rua ou choro pela desgraça de ter 2 ônibus cacarecos nessa cidade!",0,0,False,,Sat Mar 23 03:00:32 +0000 2019
