full_text,reclamacao
"Conversas saudáveis com a miga pra tampar o desespero 



[22/01/2019 19:49:20] Tami ❤: Eu tinha q ter ido bem em natureza

[22/01/2019 19:49:34] Alu: Quem mandou jogar o lixo na rua

[22/01/2019 19:49:57] Tami ❤: Ksksjwjwjwkskkskwkskskksjjsniskskakakkwkska",não

"nao podemos julgar o próximo....



mas se jogar lixo na rua pode sim",não

"Se você coloca o lixo no bolso pra evitar jogar na rua, tu merece o mundo!",não

"Reclamam reclamam das catástrofes q estão acontecendo, de enchentes e etc, mas não sentem um receio quando jogam um lixo na rua, ta viajando e jogam coisas p fora do carro, e assim vai... lacrar na internet todo mundo quer, agr na vida real q n tem plateia é um 💩 pra natureza",não

"""Eu guardo meu lixo no bolso pra não jogar na rua"" https://t.co/N3vpEiGqwJ",não

@nandis_fay Minha vo não acha lixo brilhante na rua,não

"Recém-nascida é encontrada em saco de lixo em rua de Santa Cruz, na Zona Oeste. https://t.co/PrqQDfystv",não

"Quem joga lixo na rua, não tá jogando lixo na rua de fato, pq o lixo acaba sendo quem jogou",não

Em pleno 2019 e ainda temos que avisar as pessoas pra não jogar lixo na rua pqp,não

"@FelipeBetim Ah, deveria ser vagabundo! Tava fazendo o que na rua? Se a PM fez isso foi pq teve motivo. 



Contém ironia, deboche 



Esse é o discurso de merda que essa gente lixo usa pra justificar matança e ódio sem limite. Nojo!",não

"Eu: eu sou lindo meu corpo é um templo



Eu 5min depois: como eu OUSO botar esse esse LIXO que eu chamo de corpo na rua?????",não

"@cabojunioamaral CARA ruim de mira, errar o ""globo"" a meio metro do verme... amanhã esse LIXO estará na rua fazendo outra vítima. NÃO PODE VACILAR!!",não

@jandira_feghali O morador de rua vai na conta de vcs. Mentirosa e mau caráter. Lixo da política.,não

"hoje mexi num cachorrinho na rua, fiquei tao triste de ir embora e deixar ele comendo o lixo lá",não

"Rua Sebastiana Monteiro de Santana na Vila Real/Frei Damião. Esgoto correndo a céu aberto, mato tomando as calcadas e lixo acumulado numa cidade onde a população paga caro pela coleta. Moradores já solicitaram inúmeras... https://t.co/C6loO1bMVQ",sim

"O cara tá colocando anúncio em adesivo do poste e joga NA RUA o papel sem a cola com a puta lixeira na frente! Falei ""joga o papel no lixo, pelo menos"" e ele disse ""tem quem cata"". Mds, o que eu tô fazendo neste planeta?!!",não

"Pena eu tenho dos doguinhos que dormem na rua, no frio, não têm nem comida, têm que revirar lixo, eu não tenho condições de abrigar aqui em casa, do Sidão eu tenho ódio",não

"Que ódio de gente tacando lixo na rua pqp, vai alagar essa porra fdp",não

Esse é o mesmo povo que vem nas redes socias reclamar que as ruas estão alagadas! E ainda me encheu de desaforo quando eu perguntei se ia jogar lixo na rua.,não

sabe oq eu tenho vontade de fazer com esses porras que jogam bituca de cigarro na rua? ENFIAR UMA BITUCA NO CU E OUTRA NO OLHO QUE INFERNO VELHO CUSTA JOGAR NO LIXO? ah mas n tinha lixo perto AÍ ISSO É UM PROBLEMA SEU E NAO DO PLANETA,não

Gritaria aqui na rua foi lixo na hora dos pênaltis kkkkk !!,não

"Tava me sentindo um lixo quase chorando na rua



Chego em casa tomo banho e boto roupa masculina



Me sinto a sapatao mais linda do mundo e queria ser outra pessoa so pra poder me pegar



Sei la sextou mt e eu to mt gata quem negar mentiu",não

Estou saindo só o lixo favor ngm me encontrar na rua,não

fica reclamando dos alagamentos mas fica jogando lixo na rua #pordentrocomcardinot,não

"lyka chegou em casa agr ja foi botando os lixo na rua organizando a cozinha, eh disso q eu to falando",não

I liked a @YouTube video https://t.co/uWTA1QLoaa jogando lixo na rua,não

"bts: agora pare de nos assistir e vá estudar para seus exames



exo: eu quero proteger você, para sempre



got7: você deslumbra, tao linda em todos os sentidos



voces: kpop lixo, ninguem entende nada



mic duiguinho: taca a bebida depois taca a pica e abandona na rua



voces: ok",não

Eu amo meus amigos só q eles jogam lixo na rua afs,não

Hoje é um daqueles dias da tpm que to me sentindo um lixo jogado na beira da rua que até o caminhão do lixo rejeita,não

"[4/2, 17:28] toro 🐃: as vezes eu vou jogar um lixo na rua e lembro que tu me incentivou a não jogar la no início da amizade e penso ""suh iria se decepcionar cmg se eu jogasse""",não

"O pessoal de Joinville está muito porco ultimamente. Por onde você passa na rua, tem um monte de lixo",não

sabe oq é isso????? fica jogando o carai dos lixo na rua ai quando alaga reclama ne,não

@kmaiconkusterkk @kkkkustermaicon @KusterTriggered @maikunkuster fodase oq mlk ta achando q eh quem?.. te acho na rua te meto um socao quero ver me encarar esse aqui eh irmão desse aqui oh fdp do caralho lixo,não

"@NaoInviabilize Isso é muito real. Ja quase fiz o cara que dirigia a van escolar (na minha epoca de escola) bater a van pq vi um cachorro na rua e ele ia passar por cima, mas era só um saco de lixo.",não

Que gente lixo que abandona os dog na rua,não

Aí eu disse que eu onde eu moro agora também há uma ignorância bizarra em torno disso tipo eu moro no morro e não tenho vizinho na frente pq é td decida barranco e vai laa na rua debaixo Aí de tava falando que as pessoas vêm do final da rua com suas sacolinhas de lixo e jogam o,não

qual o problema das pessoas q jogam lixo na rua,não

"Esse povo dessa rua é uo ,bota lixo tudo aqui na porta da minha mãe,vou começa a joga nas porta tbm",não

"Se você coloca o lixo no bolso para não jogar na rua parabéns você merece o mundo!❤️

@sincerojesuis",não

"povo reclama que chove e alaga as ruas, ENTÃO POR QUE VOCÊS JOGAM LIXO NA RUA ????",não

Medo de sair na rua e o caminhão do lixo me levar...😶🚚,não

"@prefeituraserra 

Cadê os agentes da dengue da prefeitura  que não estão fiscalizando este monte de lixo e focos da dengue encima da calçada no bairro: são Diogo 1 na serra?



Este ponto viciado de lixo fica na rua Coelho Neto, próximo ao status motel... https://t.co/EN2MoTyhVd",sim

Eu fico olhando esse povo saí de casa na praia ao invés de levar uma sacola p jogar o lixo fora JOGA TUDO NA AREIA E NA RUA Ô ÓDIO https://t.co/sxDuqDAXa9,não

"@macunaimaz Não sei o que é pior, a Sra. jogando lixo na rua poluindo a cidade ou a pessoa que viu, filmou calado e deixou ela continuar poluindo.",não

"Terça-feira o caminhão do lixo passou antes das 7h aqui na rua. Eles viram minha mãe e pediram café, mas a minha avó disse pra pararem na volta pq ainda ia comprar pão. Na volta pararam e tomaram café com pão. Eu queria tá acordada pra mostrar esse momento pro @belemtransito 😆",não

Nunca pensei q a maior dificuldade de morar sozinha seria conseguir colocar o lixo na rua antes do caminhão passar sinceramente,não

"@PrefBelfordRoxo eis a máquina que seria pra asfaltar na rua Juscelino Kubitschek no Parque Esperança e virou caçamba de lixo, ela está aí desde o fim das eleições bem em frente a uma creche, mas o Sr sabe pq já mandei outras vezes. https://t.co/fFukKWMfqc",não

"tenho um ódio de quem joga lixo na rua, vai tomar no cUUUUUUUUU",não

"Mano esse vídeo é eu toda quando tô andando e alguém joga lixo na rua sério façam, a reação das pessoas é sublime (cuidado só pra não tentarem te atropelar pq acontece também) https://t.co/5YrTLhOiag",não

Povo foi pra rua hj protesta a favor da educação mais na globo lixo tinha nego pedindo Lula livre? ué é pela educação ou protesto a favor do luladrão? Esse povo da esquerda é sem noção.,não

A próxima vez que eu pegar algum fela da mãe jogando lixo que possa acumular água na rua eu vou brigar demais,não

"meu, qual a dificuldade de jogar a porra do lixo no lixo??? enfia no cu essa desgraça, mas NÃO joga na rua!!!",não

"Hoje eu tava vindo pra casa e quando paramos no sinal o cara da van que tava na frente simplesmente jogou o copo descartável dele com papel do salgado pela janela e eu quase desci da van e fui tacar o lixo na cara dele(n fiz pq eu poderia apanhar no meio da rua né, infelizmente)",não

Vamos jogar lixo na rua pro varredor não perder o emprego #pas https://t.co/e8Avkjm76W,não

"#Lixo #CidadeNova #Itajaí



MORADORES RECLAMAM DE LIXO NO CIDADE NOVA



Moradores da Rua Maria Alves Mafra no Bairro Cidade Nova em Itajaí reclamam do lixo que está acumulando na rua, além de atrair ratos e... https://t.co/K4h4a20JS4",sim

"""Coloco o lixo na rua e em 20 minutos algúem passa e come esse lixo"" https://t.co/LslQSSNBQc",não

"É como uma conhecida falou

“Não adianta o cachorro pode ter a melhor ração em casa, mas na rua ele fuça no lixo”",não

"engordei tanto q to com vergonha de sair na rua.

eu sou um lixo",não

peço desculpas pra qm me ver na rua pq to o próprio lixo hj,não

"paulistano é merda

para de jogar lixo na rua seu fdp",não

"Joga lixo na rua depois reclama de alagamento, vai lá boçal",não

"@comlurbcomunica só pode ser desconhecimento da cidade planejar uma rota de coleta de lixo numa rua com 1 pista em horário de rush.

Prefeito Dulcídio Cardoso na ABM às 7:30 da noite e brincadeira",sim

"@FeCastanhari @jairbolsonaro Assim como eu não jogo lixo na rua pq não quero entupir boeiro.. independente de ter multa ou não. Eh questão lógica e de educação.  Por favor  pare de criar história e coloca na conta do governo responsabilidades que devem ser nossas. ( Nós, povo) boa noite",não

"@visaooeste A CIDADE DE OSASCO ESTA ABANDONADA!

AS RUAS ESTÃO TODAS ESBURACADAS, VOU DAR UAM VIA DE MILHARES QUE ESTÃO UM LIXO.

A RUA QUE FICA NA FRETE DA ESCOLA JULIA LOPES, É TANTO REMENDO E BURACO QUE PARECE QUE O LOCAL FOI BOMBARDEADO.",sim

"nem precisa ser só na praia, achou na rua pega e joga no lixo, se cada um catar uns 3 por dia faz uma diferença gigante https://t.co/w2IPrEjoxt",não

» Prefeitura de Major Vieira orienta população para não jogar lixo na rua - JMais https://t.co/ErmVhnLCcs,não

Lixo orgânico também é jogado na rua Leonardo Drumond... Não tem fiscalização https://t.co/XFcar1CnRY,sim

@dudasmola @ericalouuise_ Ela vai na rua jogar o lixo e se apaixona,não

@comlurbcomunica ESTAMOS COM AS DUAS LIXEIRAS CHEIAS E SEM ESPAÇO PARA COLOCAR LIXO NA RUA DAS AMENDOEIRAS EM COSMOS .PEÇO COLETA URGENTE @Prefeitura_Rio @RIOUrgent @CampoGrandeRJ1 @InformeRJO DESCASO E ABANDONO da @comlurbcomunica https://t.co/seO1nJRwSw,sim

"@wefightt @BTS_twt Até o saco de lixo jogado na rua

#BBMAsTopSocial BTS IS OUR REMEDY (@BTS_twt)",não

ai que bicha hipócrita kkkkkkk posta a foto de lixo na praia mas joga lixo na rua kkkkkkkk me poupe,não

"Boa tarde temos que jogar o lixo no lixo e, ñ na rua https://t.co/95aXnooy1o",não

"@cabofrio_pmcf Somente na cidade de Cabo Frio, né? Pois vocês ignoram os demais distritos. Essa é a Rua da Lontras em Unamar. Falta dignidade para os moradores. Convivemos com ratos, moscas e cobras. Esse é o lixo da Prefeitura de Cabo Frio. https://t.co/e7bgwnRWBr",não

"Pena que a água não é seletiva pra levar esse povo porcalhão que deve cagar até no sofa de casa e joga lixo na rua, ai tem que fazer drenagem.



Pro caralho todo mundo, incluindo o prefeito!



#ProibirCanudoDeuMuitoCertoSIM https://t.co/pubvovqzS9",não

Isso é culpa desses troxa que jogam lixo na rua,não

@AdrianoCezak Sério q vc teve o desprazer de cruzar com aquele lixo tóxico na rua?,não

"não joga lixo na rua não filho da puta, enfia no teu cu mas não joga na rua",não

na moral como eu odeio gente que joga lixo na rua vsf https://t.co/eXfWIIy9Y7,não

"Ref: oco. das 17h44 Incêndio em Residência na Rua Andradina com a Alfredo Pujol, fogo em lixo, nas dependências externas à residência, sem vítimas, extinto e local deixado em segurança. #193R",não

"Um caminhão de lixo tombou aqui na rua e um menino ficou preso, minha irmã pediu p ajudar até a ambulância chegar mas eu to tipo (???)",não

"@pinkfloydia Siim!! Não entendo, é como se estivesse na casa de alguém e jogasse o lixo no chão, a pessoa com certeza não gostaria. A rua é de todos, deveriam pensar que não é todo mundo que gosta de viver na imundície! 🤦🏻‍♀️",não

"Nunca andem na rua escura distraídos, hoje eu caí numa pilha de lixo",não

@sensacionalislz Depois eu fico ouvindo o povo reclamar que tá tendo muita enchente mas vive jogando lixo na rua,não

"Combate ao descarte irregular de lixo na rua Água Encantada, na Vila Ede. Contamos com vocês na manutenção! ♻ #CuidarProtegerInovar https://t.co/mwVkKSGDsu",sim

Infelizmente na maioria das vezes as próprias pessoas que são prejudicadas são as mesmas que jogam o lixo na rua e nos rios https://t.co/M9oI2pdkzV,não

Fico no veneno quando vejo alguém jogando lixo na rua https://t.co/3h0p5gcxSK,não

"@Central_1746 Esse lixo esta na entrada da Rua Major Jacarandá, esquina com Rua Laurindo Rabello no Estácio há mais de uma semana. Em caso de chuva forte vai descer pela Rua São Carlos e entupir os bueiros do bairro. Tá na hora de recolher. https://t.co/hoAwHi2LEA",sim

"""esse calor é o fim dos tempos, o apocalipse""

TEU CÚ! É TU QUE JOGA LIXO NA RUA, PÕE FOGO E DESTRÓI O CARALHO TODO PNC https://t.co/8DXhJG0ukY",não

"Aqui na esquina da Evaristo de Morais com a Rua das Rosas!!

Virou depósito de lixo, os porcos imundos sujam e o canalha não manda ninguém recolher. https://t.co/YAHMva8IlC",sim

tanta lixeira e o povo insiste em jogar lixo na rua https://t.co/fM8drWP9Mv,não

Reclama de alagamento mas fica jogando lixo na rua.,não

"Ae, se vc joga lixo na rua, vc é um bosta e ponto n tem discussão.",não

"Como assim não pode mais lixo na rua, e o meu direito de ir e vir como fica?",não

"@Lakeofme Minha vó foi lá brigar KKKKKK a muié jogou lixo NA RUA e ainda achou ruim reclamarem, tomara q o chinelo arrebente no meio da rua",não

"Caraí fi a @annykaroline45  e minha mãe gostam de uma treta kkkk

Elas saíram aqui na rua pra ver a treta do cara do caminhão de lixo com o outro homem e ainda debocharam do cara mano kkkkkkkkkkkkkkkkkkkk",não

Acabei de resgatar um gatinho aqui na rua que tava miando embaixo de entulhos/lixo,não

@jairbolsonaro Filha de São Paulo lixo! No dia 26/05 todos na rua apoiando nosso Presidente!,não

Denuncia sobre descarte de lixo ao lado panificadora Maranata 2 na frente dos predinhos na rua Salvador Dali.  os funcionários tem falado que fizeram de tudo para não jogarem os seus… https://t.co/1RzKPtyltk,sim

@CiaSabesp A sabesp no Guarujá está um lixo. Em frente minha casa obesgoto brota na rua os carros passam e os pedestres levam um banho de merda. Chamada sabesp disseram ser agua de chuva mesmo sem chuva ?? Piada. Não sabem a diferença de água de chuva e água de esgoto. Vergonha https://t.co/qW9fPwfk29,sim

Lixo e plástico queimando na rua General Garzon no Jardim Botânico. Muita fumaça no local @OperacoesRio @cbmerjoficial https://t.co/hVHdy0BJTT,sim

Peguei a latinha que a mulher jogou na rua e joguei no lixo,não

"mulher preta precisa construir auto estima todo dia pra não se achar um saco de lixo e até a mais linda e ovacionada em internet, é silenciada na rua então tem coisas q vcs acham banais e infantis em um relacionamento, q faz toda a diferença na nossa vivência. respeitem isso",não

@dooodaxe @maclas2ferraz ninguém precisa morar perto para você não jogar lixo na rua. não jogue para demostrar sua capacidade de ser humano.,não

"Tem dias que eu me acho tão linda, mas tem vezes que eu me sinto um lixo largado na rua",não

O motivo das ruas alagadas é o lixo que vcs jogam na rua mesmo,não

"@viclicia99 @ferrmatheus To de olho no meio ambiente hj, quase bati no cara q jogo lixo na rua",não

"Meu pai botou os sacos de lixo aqui na porta pq daqui a pouco passa o carro do lixo, mas o povo abriu todos os sacos e espalharam o lixo pela rua todaaaaa 😭",não

"@delucca Apesar que no carnaval a galera joga muito lixo na rua, não foi o caso???????",não

"#sp1 caos na rua Estêvão marcate,itaim paulista Zona leste!!! Carros lotam a rua! Funcionários da empresa de onibus #transunião param na rua e atrapalham moradores!!! Caminhão de lixo não conseguiu passar na rua hoje!!! Um descaso!!! Rua tranquil se tornou um caos só!!! https://t.co/htRz24vKu6",não

É eu sair igual um lixo na rua que eu encontro todo mundo 😴😴😴,não

"@yoonseot porra hj eu me vi usando um samsung na rua, vai si fude naum vale nada essa porra peguei da minha mao e joguei no lixo hauhauhauhau",não

"Tem homem que parece o caminhão da Comlurb né?Qualquer lixo que vê na rua sai catando, nojinho rs",não

se o carro do lixo estivesse passando por aqui hoje e eu estivesse na rua ELES COM CERTEZA me jogaram no carro por motivos de confundir pois estou UM LIXO HUMANO nessa quinta feira,não

Cheguei na rua bem na hora do caminhão de lixo,não

"Tenho pavor em jogar lixo na rua, fico segurando até achar uma lixeira",não

"Menina bonita passando na rua hoje. Jogou lixo no Rio, Que vontade de xingar ela",não

deixa eu te contar uma coisa: SE VC JOGA LIXO NA RUA VC NÃO TEM O DIREITO DE RECLAMAR DAS ENCHENTES MEU ANJO,não

@GBA_23 Verão é bom. Calor infernal é culpa do aquecimento global. Chuva que alaga é culpa do lixo que as pessoas jogam na rua e falta de manutenção do governo. Morada de mosquito também se deve a irresponsabilidade das pessoas que deixam objetos onde ele pode se proliferar. Verão é bom.,não

gente que joga lixo na rua = aberração,não

"Eu não gosto de jogar lixo na rua, sempre minha mãe e a escola me ensinaram que lixo é no lixo. Eu me incomodo de ver lixo nas praias!!!!! Fico até recolhendo!!! https://t.co/476hsgUQtk",não

"Dia 3: Lixo na rua 😡

#bksaocaetanodosul

Burger King da Avenida Goiás em São Caetano do Sul — em Burger King Brasil https://t.co/86hbk9xi3G",não

"Quem guarda lixo na mochila pra não jogar na rua e depois esquece de jogar fora, me add",não

» Prefeitura de Major Vieira orienta população para não jogar lixo na rua - JMais https://t.co/wG0UESHCcB,não

Vamos ver se agora vão parar de jogar lixo na rua depois desses alagamentos,não

"Exato, ninguem é contra diversão, festa, alegria, agora se pra você é divertido quebrar garrafa na rua, jogar lixo no chão e travar escadas rolantes tu é muito merda. https://t.co/j30AJLcbww",não

"acho que a metade do lixo do mundo tava nas minhas roupas, gavetas e mochila 

eu amo 

tragam o lixo de vcs pra casa meninax mas não joguem na rua ok",não

"Tô vendo geral postando sobre pessoas que jogam lixo na rua, porém essas mesmas pessoas também jogam. É muita hipocrisia 😒",não

@diegomaurilo @belemtransito @SeMOB_Bel Uma vez eu quase dei de cara com um caminhão de lixo. Dobrei dá José pio pra rua do una e o caminhão vinha na contramão.,não

"Há mais de um mês temos que conviver com este monte de lixo e entulhos na Rua Manoel Delfim Sarmento, 184/185, piorando o comércio e o funcionamento da Clínica Médica, já dificultados pelos engarrafamentos de ônibus e caminhões nesta rua mal organizada pelo Serviço Público",sim

@comlurbcomunica ESTAMOS COM AS DUAS LIXEIRAS CHEIAS E SEM ESPAÇO PARA COLOCAR LIXO NA RUA DAS AMENDOEIRAS EM COSMOS PEÇO COLETA URGENTE. @Prefeitura_Rio https://t.co/6HFYR2QDJG,sim

"Dor de cabeça e fome tá sendo lixo, mas se eu tivesse com dinheiro estaria na rua de fato",não

#SPTV na rua souza breves na Zona leste em frente a escola Joao dias da Silveira tambem ta cheio de lixo e entulho.,sim

bem q poderiam atualizar os pecados capitais e colocar jogar lixo na rua como um deles p ver se esse povo entende de uma vez por todas,não

Problema de mora sozinho o lixo não vai pro caminhão sozinho eu tenho que por lá na rua e alguém põem no caminhão que absurdo,não

ai gente que nervoso de mim eu coloquei o lixo reciclável na rua ontem achando que ontem era quinta feira puta que pariu o pior é que ontem era dia de lixeiro então meu lixinho reciclável foi levado pelo caminhão de lixo normal caralho tô triste,não

"“qualquer chuvinha natal alaga”

also o natalense jogando lixo na rua: https://t.co/tE8Xpe8TMT",não

Eu queria entender o que se passa na cabeça do ser humano que coloca fogo em lixo na rua pqp só pode ser muito babaca mesmo,não

Quando pensarem em jogar lixo na rua lembre-se desses alagamentos ai,não

"Ah mas vai tomar bem no CU com essa merda de inverno, cheio de bichinho e gente passando frio na rua, gripe, pé gelado e vocês ainda tem A CORAGEM de me dizer que gostam dessa estação lixo",não

Um dia eu ainda vou apanhar na rua por pegar o lixo q os outros jogam no chão e jogar na lixeira com a famosa cara de cu,não

"mano, eu passo uns nervoso na rua por causa de homem lixo que as vezes eu acho que vou passar mal",não

"@jft1914 @MoisesAraujo4 @Arua_Macedo @AndrewPrudente @marcoo_83 @EstevamGabrielC @ReciboSEP1 QUANDO vejo um video assim VEJO COMO LIXO COMO VC TEM UMA MERDA de vida FICA TECLANDO aqui E SAI PRA RUA E VE ESSE TIPO DE PEPPA que fala veRdade NA CARA DE VCS HAHAHAHAHAHAHA



e por isso QUE VCS SAO PIADA PRONTA



CHUPA SEU OTARIO HAHAHAHAHAHAH https://t.co/FUfn1SVvpE",não

"@OperacoesRio : Pessoas estão pondo lixo e entulho na calçada de uma empresa de ônibus que fica na RUA D.EMÍLIA,em Inhaúma em frente à Igreja Presbiteriana. Prefeitura retira,mas não multa e fiscaliza e lixo retorna! Ajudem por gentileza!",sim

Sou a pessoa mais lixo pra conhecer alguém na rua,não

Todo final de semana minha irmã vai pra baile e minha mãe nem fala nada ai eu piso o pé na rua pra colocar o lixo minha mãe ja está perguntando onde eu vou,não

"EU ODEIO GENTE Q JOGA LIXO NA RUA.

Seja papelzinho de bala ou não cara, qualquer lixinho q a pessoa joga na rua já me estressa",não

"que raiva de quem joga lixo na rua, TOMAR NO CU",não

"mano 2020 já é ano que vem

e eu pensando que em 2020 já ia ter carros voadores e mais uma pá de coisas tecnológicas maior dahora 

só que ao invés disso a única coisa que o ser humano sabe fazer é jogar lixo na rua",não

"parece que um anula o outro, os caras são maravilhosos mas puta que pariu, eles tratam as minas igual lixo que joga na rua mano, parece que não receberam educação",não

"Sempre quando estou na rua, uma senhora sempre bota o lixo no lugar aqui na rua certinho e tal",não

"Pessoas que vc deve evitar:

- quem maltrata animais

- quem maltrata idosos

- quem joga lixo na rua",não

"Caraca muito impressionada com esses homens na rua , casados e comprometidos com uma pessoa legal , aí não pode vê uma mulher na rua q quer falar Graçinha gostosa e isso e aquilo !! Que vergonha de homens !!!!! Valoriza quem te valoriza lixo tem em qualquer lugar!",não

"@Lilasoca @augustosnunes Oieee..o problema é  que o ""congresso"" tem o rabo preso.

A Grande maioria deles...principalmente a corja da esquerda..e não querem que seja aprovado na íntegra o pacote.

Vamos fazer nossa parte..

Ir pra rua..mas infelizmente o lixo esquerdista tem à maioria.",não

gente qual a dificuldade de jogar o lixo no lixo ao invés de jogar na rua? vai cair a mão por acaso caralho,não

"Querido satanás, leve homens que mexem com mulher na rua e pessoas que jogam lixo no chão. 

                      com amor, Rebeca Felix",não

"@Estadao É curioso que os ativistas ambientais fazem o inferno quando uma rodovia é duplicada evitando a morte de milhares de pessoas, mas ficam quietinhos quando uma comunidade desmata, polui córregos e rios, e jogam lixo na rua.",não

"agora qualquer chuvinha minha rua alaga mano 

PAREM DE JOGAR LIXO NA RUA CARALHO",não

"Vi uma latinha na rua, estava indo direto ao bueiro 

Peguei-a e coloquei no lixo :)",não

"ODEIO gnt que joga lixo na rua, de vdd, me irrita mttt",não

"@thatboyalx O Braga a ser campeão n ia haver pessoas na rua quanto mais lixo! E podes ter 100% certeza que nenhum outro clube ia fazer tantos estragos!, talvez metade! Mas a culpa é de quem organiza essas festas!rotundas cobertas d elixo as 12:00 horas logo enfrente a uma casa do benfica?",não

"Tudo o que mais foi pedido era pra que não jogassem lixo nas ruas no dia de hoje devido a chuva, mas a quantidade de saco que tem na rua é assustadora. Enquanto tem gente fazendo de tudo pra melhorar, tem o povo que vive no país das maravilhas nem aí pra nada, isso é muito triste",não

thanks god por não me ter cruzado com lixo hoje na rua kkk,não

"@OficialFGF @Gremio @SCInternacional Lixo de FEDERAÇÃO,  quanto foi a mala branca ao juiz? Expulsão clarrisma do André,  Renato dando soltando a franga,  botando dedo na cara, era rua tbm! Esse gaúchao perdeu a moral!",não

"Xô ver se eu entendi: o pessoal "" amante da natureza good vibes orgânico yes canudinho de alumínio"" foi pro bloco e deixou na rua toneladas de lixo? Hummm.....",não

@RomarioOnze Separar o lixo na hora da coleta. Jogar o lixo na lixeira e não na rua...,não

"Minha mãe ficou pistola pq tem um vizinho jogando lixo na nossa porta , ela fez um escândalo na rua KKKKKKKKKKKKKKKKKKKKK  OS VIZINHOS APARECERAM NA JANELA KKKKKKKKKKKK",não

Qual a necessidade da @PrefeituraBNU colocar a coleta de lixo na rua Antônio da Veiga as 18:30 horas numa sexta-feira?,sim

"se tem uma coisa que me dá uma gastura é ver alguém jogando lixo no meio da rua, a vontade de ir lá juntar e jogar na cara da pessoa não cabe em mim",não

"@babi concordo com tudo e queria estender um pouco a reclamação

você. isso, você aí que joga lixo na rua — copo descartável, folha de caderno, plástico —, pode tá bem longe da sua casa, e no seu bairro pode não ter perigo de alagamento, mas tenha empatia e não fica entupindo bueiro",não

